Key,SourceString
"00_in_ares_jar_description","An old jar, stoppered so tightly that it can\'t be opened."
"00_in_ares_jar_flavor","This jar is definitely talking..."
"00_in_ares_jar_name","Strange Jar"
"01_ff_kaenas_sword_description","This sword belonged to Kaenas, a warrior of Pyrgos."
"01_ff_kaenas_sword_flavor","A family heirloom sword, old but well-oiled and sharp."
"01_ff_kaenas_sword_name","Kaenas\'s Sword"
"01_ff_m_bs_militia_badge_description","This marks you as a member of the Pyrgos militia."
"01_ff_m_bs_militia_badge_flavor","A weathered iron pin, reused over the years."
"01_ff_m_bs_militia_badge_name","Militia Badge"
"01_ff_m_bs_quest_areion_charm_description","A charm containing the spirit of the divine horse Areion. A gift from your mentor, Aristonoe."
"01_ff_m_bs_quest_areion_charm_flavor","It\'s made from a metal you can\'t identify, and thrums with magical warmth."
"01_ff_m_bs_quest_areion_charm_name","Areion\'s Charm"
"01_ff_m_moc_dye_phial_description","Once Nemesis\'s divine tool, used to re-absorb her spent divine energy, the Moirai arranged for it to fall into your hands."
"01_ff_m_moc_dye_phial_flavor","It swirls with dark power that responds to your touch."
"01_ff_m_moc_dye_phial_name","Dye Phial"
"01_ff_m_vy_pan_horn_description","A piece of the God of the Wild’s horn, sliced off in combat."
"01_ff_m_vy_pan_horn_flavor","It pulses with strange power and smells of deep forests."
"01_ff_m_vy_pan_horn_name","Pan\'s Horn"
"01_ff_s_ct_trophy_description","A militia commander in the enclave will likely want to see this."
"01_ff_s_ct_trophy_flavor","A piece of a mother crab\'s shell. Crabs seem to be repulsed by it."
"01_ff_s_ct_trophy_name","Iridescent Crab Shell"
"01_ff_s_gns_snake_blood_description","The key ingredient in brewing a cure to a Gorgon snake\'s petrifying bite."
"01_ff_s_gns_snake_blood_flavor","The blood of a vanquished Gorgon snake."
"01_ff_s_gns_snake_blood_name","Gorgon Snake Blood"
"01_ff_s_gns_snakebite_cure_description","A potion that should cure a Gorgon snake\'s petrifying bite."
"01_ff_s_gns_snakebite_cure_flavor","A concoction made using the blood of a vanqished Gorgon Snake."
"01_ff_s_gns_snakebite_cure_name","Snake Bite Cure"
"01_ff_s_gs_statue_piece_head_description","A broken head piece of a larger statue that could be reassembled... if one had all the pieces."
"01_ff_s_gs_statue_piece_head_flavor","A sculpted stone likeness of the sea-god Glaukos... or, his head at least."
"01_ff_s_gs_statue_piece_head_name","Broken Statue Head"
"01_ff_s_gs_statue_piece_staff_description","A broken staff belonging to a larger statue that could be reassembled... if one had all the pieces."
"01_ff_s_gs_statue_piece_staff_flavor","The staff this stone likeness represents seems to have been fashioned from a boat\'s oar."
"01_ff_s_gs_statue_piece_staff_name","Broken Statue Staff"
"01_ff_s_gs_statue_piece_tail_description","A broken tail piece of a larger statue that could be reassembled... if one had all the pieces."
"01_ff_s_gs_statue_piece_tail_flavor","A sculpted fish-like tail, broken off from a larger stone figure."
"01_ff_s_gs_statue_piece_tail_name","Broken Statue Tail"
"01_ff_s_gs_statue_piece_torso_description","A broken torso piece of a larger statue that could be reassembled... if one had all the pieces."
"01_ff_s_gs_statue_piece_torso_flavor","The mighty stone likeness of an oceanic god\'s torso."
"01_ff_s_gs_statue_piece_torso_name","Broken Statue Torso"
"01_ff_s_gy_incense_description","A tool given to you by Nephele to restore the overrun graveyard."
"01_ff_s_gy_incense_flavor","The warm scent of frankincense helps to calm the dead."
"01_ff_s_gy_incense_name","Incense"
"01_ff_s_hh_headhunter_badge_description","The militia commander in Pyrgos will certainly want to see this."
"01_ff_s_hh_headhunter_badge_flavor","The symbol of command for an ichthian warrior--a tooth ripped from the mouth of a shark during one of their dark trials."
"01_ff_s_hh_headhunter_badge_name","Commander Medallion"
"01_ff_s_hks_bull_coin_description","An ancient coin from a bygone era, found on the beach where I washed ashore."
"01_ff_s_hks_bull_coin_flavor","It\'s strangely warm…"
"01_ff_s_hks_bull_coin_name","Large Bull Coin"
"01_ff_s_hks_bull_faced_coin_description","An ancient coin from a bygone era, found on the beach where I washed ashore."
"01_ff_s_hks_bull_faced_coin_flavor","It\'s strangely warm…"
"01_ff_s_hks_bull_faced_coin_name","Large Bull-Faced Man Coin"
"01_ff_s_hks_serpent_coin_description","An ancient coin from a bygone era, found on the beach where I washed ashore."
"01_ff_s_hks_serpent_coin_flavor","It\'s strangely warm…"
"01_ff_s_hks_serpent_coin_name","Large Serpent Coin"
"01_ff_s_hs_caduceus_description","The end looks like it\'s meant to fit into a socket."
"01_ff_s_hs_caduceus_flavor","The symbol of Hermes, a winged staff entwined by two serpents."
"01_ff_s_hs_caduceus_name","Caduceus"
"01_ff_s_mc_chicory_description","The favorite snack of Stolos\'s cows."
"01_ff_s_mc_chicory_flavor","Green, fresh and tasty."
"01_ff_s_mc_chicory_name","Chicory"
"01_ff_s_mc_sobrietypotion_description","A potion brewed to sober up Stolos."
"01_ff_s_mc_sobrietypotion_flavor","Smells like fresh herbs and mint."
"01_ff_s_mc_sobrietypotion_name","Tincture of Clarity"
"01_ff_s_mi_shiny_stone_description","A sign of friendship between man and monster."
"01_ff_s_mi_shiny_stone_flavor","This rock is pretty, but doesn\'t look particularly valuable."
"01_ff_s_mi_shiny_stone_name","Shiny Stone"
"01_ff_s_ng_moly_description","Restores what has been transformed."
"01_ff_s_ng_moly_flavor","Moly, the gods call it, and it is hard for mortal men to dig; but with the gods all things are possible."
"01_ff_s_ng_moly_name","Moly Root"
"01_ff_s_ng_naiads_lily_description","The beauty of this flower is enough to drive even the staunchest heart to despair. What magical creature was it stolen from?"
"01_ff_s_ng_naiads_lily_flavor","The longer you behold the flower, the more difficult it is to look away..."
"01_ff_s_ng_naiads_lily_name","Sacred Lily"
"01_ff_s_wcs_phantom_spider_item_description","An alchemical ingredient."
"01_ff_s_wcs_phantom_spider_item_flavor","Gooey remains of a magical spider."
"01_ff_s_wcs_phantom_spider_item_name","Spider Excretion"
"01_ff_sss_smoke_signal_key_description","A key found amid ichthian smoke signals."
"01_ff_sss_smoke_signal_key_flavor","A simple iron key."
"01_ff_sss_smoke_signal_key_name","Key"
"01_ff_swr_wedding_rings_description","Two coppers rings used to symbolize a couple’s engagement."
"01_ff_swr_wedding_rings_flavor","They’re crusted with sea salt and specks of blood."
"01_ff_swr_wedding_rings_name","Betrothal Rings"
"02_nb_m_mr_crystal_debris_description","A glowing crystal found in some Mycenaean Ruins."
"02_nb_m_mr_crystal_debris_flavor","This crystal pulses with warmth."
"02_nb_m_mr_crystal_debris_name","Crystal"
"02_nb_mtm_mycenian_treasure_map_description","A rough map, created to find the treasure of Queen Erana\'s golden hoard."
"02_nb_mtm_mycenian_treasure_map_flavor","Rough parchment with a hasty map and scribbled annotations."
"02_nb_mtm_mycenian_treasure_map_golden_skeleton_head_description","The skull of a golden skeleton."
"02_nb_mtm_mycenian_treasure_map_golden_skeleton_head_flavor","It\'s cold to the touch."
"02_nb_mtm_mycenian_treasure_map_golden_skeleton_head_name","Golden Skull"
"02_nb_mtm_mycenian_treasure_map_name","Treasure Map"
"02_nb_s_ae_cabbage_description","Chelonis requested this for his lunch."
"02_nb_s_ae_cabbage_flavor","A fresh, crunchy cabbage."
"02_nb_s_ae_cabbage_name","Cabbage"
"02_nb_s_ae_prison_key_description","A key found in an old Mycenaean prison."
"02_nb_s_ae_prison_key_flavor","The cold iron of the key is centuries old."
"02_nb_s_ae_prison_key_name","Cell Key"
"02_nb_s_ch_crab_shell_description","Gorgo, the hunter trader at the shipwrecked crew\'s camp, will likely want to see this."
"02_nb_s_ch_crab_shell_flavor","A unique piece of shell from a crab egg."
"02_nb_s_ch_crab_shell_name","Crab Eggshell"
"02_nb_s_cp_cage_key_description","This opens a pirate\'s cage."
"02_nb_s_cp_cage_key_flavor","A crudely-fashioned key."
"02_nb_s_cp_cage_key_name","Cage Key"
"02_nb_s_gd_lost_toy_description","An old memento belonging to Kallias, at the Travelers\' Refuge."
"02_nb_s_gd_lost_toy_flavor","The beloved toy of a child."
"02_nb_s_gd_lost_toy_name","Lost Toy"
"02_nb_s_is_ichthian_sacrifice_item_1_description","An oddity found near an ichthian sacrificial pool."
"02_nb_s_is_ichthian_sacrifice_item_1_flavor","A skull with a small rune carved in it, perhaps part of a sacrifice."
"02_nb_s_is_ichthian_sacrifice_item_1_name","Ichthian Skull"
"02_nb_s_is_ichthian_sacrifice_item_2_description","An oddity found near an ichthian sacrificial pool."
"02_nb_s_is_ichthian_sacrifice_item_2_flavor","A skeletal hand, cleanly severed, like a grisly offering."
"02_nb_s_is_ichthian_sacrifice_item_2_name","Ichthian Claw"
"02_nb_s_is_ichthian_sacrifice_item_3_description","An oddity found near an ichthian sacrificial pool."
"02_nb_s_is_ichthian_sacrifice_item_3_flavor","The bones of this skeletal foot pulse with energy - a gift?"
"02_nb_s_is_ichthian_sacrifice_item_3_name","Ichthian Skeletal Foot"
"02_nb_s_lucky_coin_description","Coins such as this were used for good luck by the Mycenaeans."
"02_nb_s_lucky_coin_flavor","An ancient bronze coin, smooth from many hands."
"02_nb_s_lucky_coin_name","Bronze Coin"
"02_nb_s_poseidon_riddle_chest_key_description","A key found in ruins near a statue of Poseidon."
"02_nb_s_poseidon_riddle_chest_key_flavor","It looks like it opens something valuable..."
"02_nb_s_poseidon_riddle_chest_key_name","Chest Key"
"02_nb_ts_three_sisters_golden_apple_description","Three talking statues were arguing over this..."
"02_nb_ts_three_sisters_golden_apple_flavor","An apple made of solid gold."
"02_nb_ts_three_sisters_golden_apple_name","Golden Apple"
"03_ap_m_ca_incense_energy_regen_description","Grants more energy regeneration, but slower movement, when thrown into the ritual fire for the Contest of Champions."
"03_ap_m_ca_incense_energy_regen_flavor","Sweet-smelling incense used in centaur rituals."
"03_ap_m_ca_incense_energy_regen_name","Styrax"
"03_ap_m_ca_incense_magical_damage_description","Grants more elemental damage, but less energy, when thrown into the ritual fire for the Contest of Champions."
"03_ap_m_ca_incense_magical_damage_flavor","Hardened, gummy incense used in centaur rituals."
"03_ap_m_ca_incense_magical_damage_name","Frankincense"
"03_ap_m_ca_incense_magical_resistance_description","Grants more elemental resistances, but less elemental damage, when thrown into the ritual fire for the Contest of Champions."
"03_ap_m_ca_incense_magical_resistance_flavor","Smoky, spicy resin used in centaur rituals."
"03_ap_m_ca_incense_magical_resistance_name","Myrrh"
"03_ap_m_ca_iron_physical_armor_description","Grants more defense, but less offense, when thrown into the ritual fire for the Contest of Champions."
"03_ap_m_ca_iron_physical_armor_flavor","A blunt piece of iron used in centaur rituals."
"03_ap_m_ca_iron_physical_armor_name","Blunt Iron"
"03_ap_m_ca_iron_physical_attack_speed_description","Grants faster attacks, but slower movement, when thrown into the ritual fire for the Contest of Champions."
"03_ap_m_ca_iron_physical_attack_speed_flavor","A heavy lump of iron used in centaur rituals."
"03_ap_m_ca_iron_physical_attack_speed_name","Heavy Iron"
"03_ap_m_ca_iron_physical_damage_description","Grants more offense, but less defense, when thrown into the ritual fire for the Contest of Champions"
"03_ap_m_ca_iron_physical_damage_flavor","A piece of jagged iron used in centaur rituals."
"03_ap_m_ca_iron_physical_damage_name","Jagged Iron"
"03_ap_m_cc_sewers_key_name","Sewer Key"
"03_ap_m_ix_blood_of_ixion_description","A vial of blood taken from King Ixion."
"03_ap_m_ix_blood_of_ixion_flavor","The blood bubbles with strange heat..."
"03_ap_m_ix_blood_of_ixion_name","Blood of Ixion"
"03_ap_m_ix_palace_key_description","Opens the way into Ixion\'s ruined palace."
"03_ap_m_ix_palace_key_flavor","An ancient key from a bygone era."
"03_ap_m_ix_palace_key_name","Ixion\'s Palace Key"
"03_ap_m_ts_sewers_lever_handle_description","An old handle."
"03_ap_m_ts_sewers_lever_handle_flavor","This must slot in somewhere..."
"03_ap_m_ts_sewers_lever_handle_name","Lever Handle"
"03_ap_s_as_blood_of_ares_description","Can be activated by a scholar of warfare."
"03_ap_s_as_blood_of_ares_flavor","Distilled essence of a sacrifice, blessed by a god."
"03_ap_s_as_blood_of_ares_name","Blood of Ares"
"03_ap_s_br_incense_flavor","Incense found on a priest\'s corpse. Used to calm the dead."
"03_ap_s_br_incense_name","Old Incense"
"03_ap_s_cg_rebel_banner_description","Can be used to gain the attention of certain lost souls."
"03_ap_s_cg_rebel_banner_flavor","The battle flag of a defeated regiment."
"03_ap_s_cg_rebel_banner_name","Lost Regiment Banner"
"03_ap_s_co_cornucopia_horn_description","Can be given to someone who will feed the hungry of Tegea."
"03_ap_s_co_cornucopia_horn_flavor","Demeter\'s legendary horn of food that never empties."
"03_ap_s_co_cornucopia_horn_name","Horn of Plenty"
"03_ap_s_os_daedalus_ore_description","Can be smelted in divine flames on Olympos"
"03_ap_s_os_daedalus_ore_flavor","A rare material used in constructing ancient shrines and other heavenly items."
"03_ap_s_os_daedalus_ore_name","Ethereal Ore"
"03_ap_s_rs_resistance_emblem_description","Can be given to a leader of these troops"
"03_ap_s_rs_resistance_emblem_flavor","A symbol of the rebellion with a peacock scratched into the back side."
"03_ap_s_rs_resistance_emblem_name","Rebel Medallion"
"03_ap_s_wg_wolf_skull_description","The skull of a wolf."
"03_ap_s_wg_wolf_skull_flavor","Old, faded bone from a long-dead beast."
"03_ap_s_wg_wolf_skull_name","Wolf Skull"
"03_ap_s_wg_wolfghost_skull_description","The skull of a wolf."
"03_ap_s_wg_wolfghost_skull_flavor","Old, faded bone from a long-dead beast."
"03_ap_s_wg_wolfghost_skull_name","Wolf Skull"
"03_ap_s_ww_leandros_key_description","It belonged to a man who was recently cursed as a wolf for sacrificing his family."
"03_ap_s_ww_leandros_key_flavor","A simple key."
"03_ap_s_ww_leandros_key_name","Leandros\'s Key"
"03_cc1_s_as_prison_key_description","Opens the Ares Temple crypt."
"03_cc1_s_as_prison_key_flavor","A blood-covered key to the crypt under Ares\'s Temple ruins"
"03_cc1_s_as_prison_key_name","Ares Temple Crypt Key"
"03_cc1_s_as_ruins_sanctum_key_description","Opens the Sanctum of the Ares Temple\'s catacombs."
"03_cc1_s_as_ruins_sanctum_key_flavor","An old key."
"03_cc1_s_as_ruins_sanctum_key_name","Temple Sanctum Key"
"04_hl_s_dp_key_name","Sykara\'s Blood Vow"
"04_hl_s_np_blood_vow_name","Sykara\'s Blood Vow"
"boss_repeat_aristomenes_description","Can be used to unlock a memory of combat at ritual shrines."
"boss_repeat_aristomenes_flavor","The skull of a fallen hero from ages past. It pulses with strange power."
"boss_repeat_aristomenes_name","Aristomenes\' Skull"
"boss_repeat_dysepilogos_description","Can be used to unlock a memory of combat at ritual shrines."
"boss_repeat_dysepilogos_flavor","An amulet inscribed with the words: \""Rage not against Fate, my love. We will meet again in Elysium.\"""
"boss_repeat_dysepilogos_name","Dysepilogos\' Amulet"
"boss_repeat_gryphon_nb_description","Can be used to unlock a memory of combat at ritual shrines."
"boss_repeat_gryphon_nb_flavor","A feather plucked from the body of a vanquished gryphon."
"boss_repeat_gryphon_nb_name","Ajax the Magnificent\'s Feather"
"boss_repeat_hippocampus_description","Can be used to unlock a memory of combat at ritual shrines."
"boss_repeat_hippocampus_flavor","A coral-like fragment of bone from a hippokampos."
"boss_repeat_hippocampus_name","Hippokampos Vertebra"
"boss_repeat_ichthian_general_locked_flavor","A tooth ripped from the jaw of the ichthian king. It pulses with strange power."
"boss_repeat_ichthian_general_locked_name","King-of-Tides\' Tooth"
"boss_repeat_ichthian_general_unlocked_description","Can be used to unlock a memory of combat at ritual shrines."
"boss_repeat_ichthian_general_unlocked_flavor","A tooth ripped from the jaw of the ichthian king."
"boss_repeat_ichthian_general_unlocked_name","King-of-Tides\' Tooth"
"boss_repeat_pan_description","Can be used to unlock a memory of combat at ritual shrines."
"boss_repeat_pan_flavor","A piece of the God of the Wild’s horn, sliced off in combat."
"boss_repeat_pan_name","Pan\'s Horn"
"boss_repeat_skirion_locked_flavor","A tuft of hair ripped from Skirion\'s monstrous form. It pulses with strange power."
"boss_repeat_skirion_locked_name","Skirion\'s Mane"
"boss_repeat_skirion_unlocked_flavor","A tuft of hair ripped from Skirion\'s monstrous form."
"boss_repeat_skirion_unlocked_name","Skirion\'s Mane"
"boss_repeat_skylla_locked_flavor","A scale shed from Skylla\'s monstrous form. It pulses with strange power."
"boss_repeat_skylla_locked_name","Skylla\'s Scale"
"boss_repeat_skylla_unlocked_description","Can be used to unlock a memory of combat at ritual shrines."
"boss_repeat_skylla_unlocked_flavor","A scale shed from Skylla\'s monstrous form."
"boss_repeat_skylla_unlocked_name","Skylla\'s Scale"
"boss_repeat_feral_hippokampos_locked_flavor","A twisted fragment of bone from a corrupted hippokampos. It pulses with strange power."
"boss_repeat_feral_hippokampos_locked_name","Feral Hippokampos Vertebra"
"boss_repeat_feral_hippokampos_unlocked_description","Can be used to unlock a memory of combat at ritual shrines."
"boss_repeat_feral_hippokampos_unlocked_flavor","A twisted fragment of bone from a corrupted hippokampos. "
"boss_repeat_feral_hippokampos_unlocked_name","Feral Hippokampos Vertebra"
"boss_repeat_ixion_locked_flavor","A jagged splinter from Ixion\'s flaming wheel. It pulses with strange power."
"boss_repeat_ixion_locked_name","Burning Splinter"
"boss_repeat_ixion_unlocked_description","Can be used to unlock a memory of combat at ritual shrines."
"boss_repeat_ixion_unlocked_flavor","A jagged splinter from Ixion\'s flaming wheel."
"boss_repeat_ixion_unlocked_name","Burning Splinter"
"da_quest_03_ap_s_ms_shield_name","Replica Aegis of Athena"
"da_quest_03_ap_s_ms_shield_description","A shield that belongs with a statue of Athena."
"da_quest_03_ap_s_ms_shield_flavor","Athena\'s aegis is a powerful divine artifact. This, however, is just a replica."
"03_ap_m_cc_sewers_key_flavor","Coated in a grimy film."
"03_ap_m_cc_sewers_key_description","A key to the Tegea Sewers."
"da_quest_02_nb_m_if_friendly_ichthian_cage_key.m_Name","Ichthian Cage Key"
"da_quest_02_nb_m_if_friendly_ichthian_cage_key.m_FlavorText","A primitive key."
